Sheet: Tabelle1
A1: SUN
C2: oct-mar | G2: apr-sept | I2: stars/planets
A3: deg | B3: min | C3: LL | D3: UL | E3: deg | F3: min | G3: LL | H3: UL | I3: deg | J3: min | K3: corr
A4: 0 | B4: 0 | C4: of:=[.$K4]+16.3 -> -17.5 | D4: of:=[.$K4]-16 -> -49.8 | E4: of:=[.A4] -> 0 | F4: of:=[.B4] -> 0 | G4: of:=[.$K4]+16 -> -17.8 | H4: of:=[.$K4]-15.8 -> -49.6 | I4: of:=[.A4] -> 0 | J4: of:=[.B4] -> 0 | K4: -33.8
A5: of:=[.A4]+IF([.B4]>=[.B5];1;0) -> 0 | B5: 3 | C5: of:=[.$K5]+16.3 -> -16.9 | D5: of:=[.$K5]-16 -> -49.2 | E5: of:=[.A5] -> 0 | F5: of:=[.B5] -> 3 | G5: of:=[.$K5]+16 -> -17.2 | H5: of:=[.$K5]-15.8 -> -49 | I5: of:=[.A5] -> 0 | J5: of:=[.B5] -> 3 | K5: -33.2
A6: of:=[.A5]+IF([.B5]>=[.B6];1;0) -> 0 | B6: 6 | C6: of:=[.$K6]+16.3 -> -16.3 | D6: of:=[.$K6]-16 -> -48.6 | E6: of:=[.A6] -> 0 | F6: of:=[.B6] -> 6 | G6: of:=[.$K6]+16 -> -16.6 | H6: of:=[.$K6]-15.8 -> -48.4 | I6: of:=[.A6] -> 0 | J6: of:=[.B6] -> 6 | K6: -32.6
A7: of:=[.A6]+IF([.B6]>=[.B7];1;0) -> 0 | B7: 9 | C7: of:=[.$K7]+16.3 -> -15.7 | D7: of:=[.$K7]-16 -> -48 | E7: of:=[.A7] -> 0 | F7: of:=[.B7] -> 9 | G7: of:=[.$K7]+16 -> -16 | H7: of:=[.$K7]-15.8 -> -47.8 | I7: of:=[.A7] -> 0 | J7: of:=[.B7] -> 9 | K7: -32
A8: of:=[.A7]+IF([.B7]>=[.B8];1;0) -> 0 | B8: 12 | C8: of:=[.$K8]+16.3 -> -15.2 | D8: of:=[.$K8]-16 -> -47.5 | E8: of:=[.A8] -> 0 | F8: of:=[.B8] -> 12 | G8: of:=[.$K8]+16 -> -15.5 | H8: of:=[.$K8]-15.8 -> -47.3 | I8: of:=[.A8] -> 0 | J8: of:=[.B8] -> 12 | K8: -31.5
A9: of:=[.A8]+IF([.B8]>=[.B9];1;0) -> 0 | B9: 15 | C9: of:=[.$K9]+16.3 -> -14.6 | D9: of:=[.$K9]-16 -> -46.9 | E9: of:=[.A9] -> 0 | F9: of:=[.B9] -> 15 | G9: of:=[.$K9]+16 -> -14.9 | H9: of:=[.$K9]-15.8 -> -46.7 | I9: of:=[.A9] -> 0 | J9: of:=[.B9] -> 15 | K9: -30.9
A10: of:=[.A9]+IF([.B9]>=[.B10];1;0) -> 0 | B10: 18 | C10: of:=[.$K10]+16.3 -> -14.1 | D10: of:=[.$K10]-16 -> -46.4 | E10: of:=[.A10] -> 0 | F10: of:=[.B10] -> 18 | G10: of:=[.$K10]+16 -> -14.4 | H10: of:=[.$K10]-15.8 -> -46.2 | I10: of:=[.A10] -> 0 | J10: of:=[.B10] -> 18 | K10: -30.4
A11: of:=[.A10]+IF([.B10]>=[.B11];1;0) -> 0 | B11: 21 | C11: of:=[.$K11]+16.3 -> -13.5 | D11: of:=[.$K11]-16 -> -45.8 | E11: of:=[.A11] -> 0 | F11: of:=[.B11] -> 21 | G11: of:=[.$K11]+16 -> -13.8 | H11: of:=[.$K11]-15.8 -> -45.6 | I11: of:=[.A11] -> 0 | J11: of:=[.B11] -> 21 | K11: -29.8
A12: of:=[.A11]+IF([.B11]>=[.B12];1;0) -> 0 | B12: 24 | C12: of:=[.$K12]+16.3 -> -13 | D12: of:=[.$K12]-16 -> -45.3 | E12: of:=[.A12] -> 0 | F12: of:=[.B12] -> 24 | G12: of:=[.$K12]+16 -> -13.3 | H12: of:=[.$K12]-15.8 -> -45.1 | I12: of:=[.A12] -> 0 | J12: of:=[.B12] -> 24 | K12: -29.3
A13: of:=[.A12]+IF([.B12]>=[.B13];1;0) -> 0 | B13: 27 | C13: of:=[.$K13]+16.3 -> -12.5 | D13: of:=[.$K13]-16 -> -44.8 | E13: of:=[.A13] -> 0 | F13: of:=[.B13] -> 27 | G13: of:=[.$K13]+16 -> -12.8 | H13: of:=[.$K13]-15.8 -> -44.6 | I13: of:=[.A13] -> 0 | J13: of:=[.B13] -> 27 | K13: -28.8
A14: of:=[.A13]+IF([.B13]>=[.B14];1;0) -> 0 | B14: 30 | C14: of:=[.$K14]+16.3 -> -12 | D14: of:=[.$K14]-16 -> -44.3 | E14: of:=[.A14] -> 0 | F14: of:=[.B14] -> 30 | G14: of:=[.$K14]+16 -> -12.3 | H14: of:=[.$K14]-15.8 -> -44.1 | I14: of:=[.A14] -> 0 | J14: of:=[.B14] -> 30 | K14: -28.3
A15: of:=[.A14]+IF([.B14]>=[.B15];1;0) -> 0 | B15: 33 | C15: of:=[.$K15]+16.3 -> -11.6 | D15: of:=[.$K15]-16 -> -43.9 | E15: of:=[.A15] -> 0 | F15: of:=[.B15] -> 33 | G15: of:=[.$K15]+16 -> -11.9 | H15: of:=[.$K15]-15.8 -> -43.7 | I15: of:=[.A15] -> 0 | J15: of:=[.B15] -> 33 | K15: -27.9
A16: of:=[.A15]+IF([.B15]>=[.B16];1;0) -> 0 | B16: 36 | C16: of:=[.$K16]+16.3 -> -11.1 | D16: of:=[.$K16]-16 -> -43.4 | E16: of:=[.A16] -> 0 | F16: of:=[.B16] -> 36 | G16: of:=[.$K16]+16 -> -11.4 | H16: of:=[.$K16]-15.8 -> -43.2 | I16: of:=[.A16] -> 0 | J16: of:=[.B16] -> 36 | K16: -27.4
A17: of:=[.A16]+IF([.B16]>=[.B17];1;0) -> 0 | B17: 39 | C17: of:=[.$K17]+16.3 -> -10.6 | D17: of:=[.$K17]-16 -> -42.9 | E17: of:=[.A17] -> 0 | F17: of:=[.B17] -> 39 | G17: of:=[.$K17]+16 -> -10.9 | H17: of:=[.$K17]-15.8 -> -42.7 | I17: of:=[.A17] -> 0 | J17: of:=[.B17] -> 39 | K17: -26.9
A18: of:=[.A17]+IF([.B17]>=[.B18];1;0) -> 0 | B18: 42 | C18: of:=[.$K18]+16.3 -> -10.2 | D18: of:=[.$K18]-16 -> -42.5 | E18: of:=[.A18] -> 0 | F18: of:=[.B18] -> 42 | G18: of:=[.$K18]+16 -> -10.5 | H18: of:=[.$K18]-15.8 -> -42.3 | I18: of:=[.A18] -> 0 | J18: of:=[.B18] -> 42 | K18: -26.5
A19: of:=[.A18]+IF([.B18]>=[.B19];1;0) -> 0 | B19: 45 | C19: of:=[.$K19]+16.3 -> -9.8 | D19: of:=[.$K19]-16 -> -42.1 | E19: of:=[.A19] -> 0 | F19: of:=[.B19] -> 45 | G19: of:=[.$K19]+16 -> -10.1 | H19: of:=[.$K19]-15.8 -> -41.9 | I19: of:=[.A19] -> 0 | J19: of:=[.B19] -> 45 | K19: -26.1
A20: of:=[.A19]+IF([.B19]>=[.B20];1;0) -> 0 | B20: 48 | C20: of:=[.$K20]+16.3 -> -9.4 | D20: of:=[.$K20]-16 -> -41.7 | E20: of:=[.A20] -> 0 | F20: of:=[.B20] -> 48 | G20: of:=[.$K20]+16 -> -9.7 | H20: of:=[.$K20]-15.8 -> -41.5 | I20: of:=[.A20] -> 0 | J20: of:=[.B20] -> 48 | K20: -25.7
A21: of:=[.A20]+IF([.B20]>=[.B21];1;0) -> 0 | B21: 51 | C21: of:=[.$K21]+16.3 -> -9 | D21: of:=[.$K21]-16 -> -41.3 | E21: of:=[.A21] -> 0 | F21: of:=[.B21] -> 51 | G21: of:=[.$K21]+16 -> -9.3 | H21: of:=[.$K21]-15.8 -> -41.1 | I21: of:=[.A21] -> 0 | J21: of:=[.B21] -> 51 | K21: -25.3
A22: of:=[.A21]+IF([.B21]>=[.B22];1;0) -> 0 | B22: 54 | C22: of:=[.$K22]+16.3 -> -8.6 | D22: of:=[.$K22]-16 -> -40.9 | E22: of:=[.A22] -> 0 | F22: of:=[.B22] -> 54 | G22: of:=[.$K22]+16 -> -8.9 | H22: of:=[.$K22]-15.8 -> -40.7 | I22: of:=[.A22] -> 0 | J22: of:=[.B22] -> 54 | K22: -24.9
A23: of:=[.A22]+IF([.B22]>=[.B23];1;0) -> 0 | B23: 57 | C23: of:=[.$K23]+16.3 -> -8.2 | D23: of:=[.$K23]-16 -> -40.5 | E23: of:=[.A23] -> 0 | F23: of:=[.B23] -> 57 | G23: of:=[.$K23]+16 -> -8.5 | H23: of:=[.$K23]-15.8 -> -40.3 | I23: of:=[.A23] -> 0 | J23: of:=[.B23] -> 57 | K23: -24.5
A24: of:=[.A23]+IF([.B23]>=[.B24];1;0) -> 1 | B24: 0 | C24: of:=[.$K24]+16.3 -> -7.8 | D24: of:=[.$K24]-16 -> -40.1 | E24: of:=[.A24] -> 1 | F24: of:=[.B24] -> 0 | G24: of:=[.$K24]+16 -> -8.1 | H24: of:=[.$K24]-15.8 -> -39.9 | I24: of:=[.A24] -> 1 | J24: of:=[.B24] -> 0 | K24: -24.1
A25: of:=[.A24]+IF([.B24]>=[.B25];1;0) -> 1 | B25: 3 | C25: of:=[.$K25]+16.3 -> -7.4 | D25: of:=[.$K25]-16 -> -39.7 | E25: of:=[.A25] -> 1 | F25: of:=[.B25] -> 3 | G25: of:=[.$K25]+16 -> -7.7 | H25: of:=[.$K25]-15.8 -> -39.5 | I25: of:=[.A25] -> 1 | J25: of:=[.B25] -> 3 | K25: -23.7
A26: of:=[.A25]+IF([.B25]>=[.B26];1;0) -> 1 | B26: 6 | C26: of:=[.$K26]+16.3 -> -7.1 | D26: of:=[.$K26]-16 -> -39.4 | E26: of:=[.A26] -> 1 | F26: of:=[.B26] -> 6 | G26: of:=[.$K26]+16 -> -7.4 | H26: of:=[.$K26]-15.8 -> -39.2 | I26: of:=[.A26] -> 1 | J26: of:=[.B26] -> 6 | K26: -23.4
A27: of:=[.A26]+IF([.B26]>=[.B27];1;0) -> 1 | B27: 9 | C27: of:=[.$K27]+16.3 -> -6.7 | D27: of:=[.$K27]-16 -> -39 | E27: of:=[.A27] -> 1 | F27: of:=[.B27] -> 9 | G27: of:=[.$K27]+16 -> -7 | H27: of:=[.$K27]-15.8 -> -38.8 | I27: of:=[.A27] -> 1 | J27: of:=[.B27] -> 9 | K27: -23
A28: of:=[.A27]+IF([.B27]>=[.B28];1;0) -> 1 | B28: 12 | C28: of:=[.$K28]+16.3 -> -6.4 | D28: of:=[.$K28]-16 -> -38.7 | E28: of:=[.A28] -> 1 | F28: of:=[.B28] -> 12 | G28: of:=[.$K28]+16 -> -6.7 | H28: of:=[.$K28]-15.8 -> -38.5 | I28: of:=[.A28] -> 1 | J28: of:=[.B28] -> 12 | K28: -22.7
A29: of:=[.A28]+IF([.B28]>=[.B29];1;0) -> 1 | B29: 15 | C29: of:=[.$K29]+16.3 -> -6 | D29: of:=[.$K29]-16 -> -38.3 | E29: of:=[.A29] -> 1 | F29: of:=[.B29] -> 15 | G29: of:=[.$K29]+16 -> -6.3 | H29: of:=[.$K29]-15.8 -> -38.1 | I29: of:=[.A29] -> 1 | J29: of:=[.B29] -> 15 | K29: -22.3
A30: of:=[.A29]+IF([.B29]>=[.B30];1;0) -> 1 | B30: 18 | C30: of:=[.$K30]+16.3 -> -5.7 | D30: of:=[.$K30]-16 -> -38 | E30: of:=[.A30] -> 1 | F30: of:=[.B30] -> 18 | G30: of:=[.$K30]+16 -> -6 | H30: of:=[.$K30]-15.8 -> -37.8 | I30: of:=[.A30] -> 1 | J30: of:=[.B30] -> 18 | K30: -22
A31: of:=[.A30]+IF([.B30]>=[.B31];1;0) -> 1 | B31: 21 | C31: of:=[.$K31]+16.3 -> -5.4 | D31: of:=[.$K31]-16 -> -37.7 | E31: of:=[.A31] -> 1 | F31: of:=[.B31] -> 21 | G31: of:=[.$K31]+16 -> -5.7 | H31: of:=[.$K31]-15.8 -> -37.5 | I31: of:=[.A31] -> 1 | J31: of:=[.B31] -> 21 | K31: -21.7
A32: of:=[.A31]+IF([.B31]>=[.B32];1;0) -> 1 | B32: 24 | C32: of:=[.$K32]+16.3 -> -5.1 | D32: of:=[.$K32]-16 -> -37.4 | E32: of:=[.A32] -> 1 | F32: of:=[.B32] -> 24 | G32: of:=[.$K32]+16 -> -5.4 | H32: of:=[.$K32]-15.8 -> -37.2 | I32: of:=[.A32] -> 1 | J32: of:=[.B32] -> 24 | K32: -21.4
A33: of:=[.A32]+IF([.B32]>=[.B33];1;0) -> 1 | B33: 27 | C33: of:=[.$K33]+16.3 -> -4.8 | D33: of:=[.$K33]-16 -> -37.1 | E33: of:=[.A33] -> 1 | F33: of:=[.B33] -> 27 | G33: of:=[.$K33]+16 -> -5.1 | H33: of:=[.$K33]-15.8 -> -36.9 | I33: of:=[.A33] -> 1 | J33: of:=[.B33] -> 27 | K33: -21.1
A34: of:=[.A33]+IF([.B33]>=[.B34];1;0) -> 1 | B34: 30 | C34: of:=[.$K34]+16.3 -> -4.5 | D34: of:=[.$K34]-16 -> -36.8 | E34: of:=[.A34] -> 1 | F34: of:=[.B34] -> 30 | G34: of:=[.$K34]+16 -> -4.8 | H34: of:=[.$K34]-15.8 -> -36.6 | I34: of:=[.A34] -> 1 | J34: of:=[.B34] -> 30 | K34: -20.8
A35: of:=[.A34]+IF([.B34]>=[.B35];1;0) -> 1 | B35: 35 | C35: of:=[.$K35]+16.3 -> -4 | D35: of:=[.$K35]-16 -> -36.3 | E35: of:=[.A35] -> 1 | F35: of:=[.B35] -> 35 | G35: of:=[.$K35]+16 -> -4.3 | H35: of:=[.$K35]-15.8 -> -36.1 | I35: of:=[.A35] -> 1 | J35: of:=[.B35] -> 35 | K35: -20.3
A36: of:=[.A35]+IF([.B35]>=[.B36];1;0) -> 1 | B36: 40 | C36: of:=[.$K36]+16.3 -> -3.6 | D36: of:=[.$K36]-16 -> -35.9 | E36: of:=[.A36] -> 1 | F36: of:=[.B36] -> 40 | G36: of:=[.$K36]+16 -> -3.9 | H36: of:=[.$K36]-15.8 -> -35.7 | I36: of:=[.A36] -> 1 | J36: of:=[.B36] -> 40 | K36: -19.9
A37: of:=[.A36]+IF([.B36]>=[.B37];1;0) -> 1 | B37: 45 | C37: of:=[.$K37]+16.3 -> -3.1 | D37: of:=[.$K37]-16 -> -35.4 | E37: of:=[.A37] -> 1 | F37: of:=[.B37] -> 45 | G37: of:=[.$K37]+16 -> -3.4 | H37: of:=[.$K37]-15.8 -> -35.2 | I37: of:=[.A37] -> 1 | J37: of:=[.B37] -> 45 | K37: -19.4
A38: of:=[.A37]+IF([.B37]>=[.B38];1;0) -> 1 | B38: 50 | C38: of:=[.$K38]+16.3 -> -2.7 | D38: of:=[.$K38]-16 -> -35 | E38: of:=[.A38] -> 1 | F38: of:=[.B38] -> 50 | G38: of:=[.$K38]+16 -> -3 | H38: of:=[.$K38]-15.8 -> -34.8 | I38: of:=[.A38] -> 1 | J38: of:=[.B38] -> 50 | K38: -19
A39: of:=[.A38]+IF([.B38]>=[.B39];1;0) -> 1 | B39: 55 | C39: of:=[.$K39]+16.3 -> -2.3 | D39: of:=[.$K39]-16 -> -34.6 | E39: of:=[.A39] -> 1 | F39: of:=[.B39] -> 55 | G39: of:=[.$K39]+16 -> -2.6 | H39: of:=[.$K39]-15.8 -> -34.4 | I39: of:=[.A39] -> 1 | J39: of:=[.B39] -> 55 | K39: -18.6
A40: of:=[.A39]+IF([.B39]>=[.B40];1;0) -> 2 | B40: 0 | C40: of:=[.$K40]+16.3 -> -1.9 | D40: of:=[.$K40]-16 -> -34.2 | E40: of:=[.A40] -> 2 | F40: of:=[.B40] -> 0 | G40: of:=[.$K40]+16 -> -2.2 | H40: of:=[.$K40]-15.8 -> -34 | I40: of:=[.A40] -> 2 | J40: of:=[.B40] -> 0 | K40: -18.2
A41: of:=[.A40]+IF([.B40]>=[.B41];1;0) -> 2 | B41: 5 | C41: of:=[.$K41]+16.3 -> -1.5 | D41: of:=[.$K41]-16 -> -33.8 | E41: of:=[.A41] -> 2 | F41: of:=[.B41] -> 5 | G41: of:=[.$K41]+16 -> -1.8 | H41: of:=[.$K41]-15.8 -> -33.6 | I41: of:=[.A41] -> 2 | J41: of:=[.B41] -> 5 | K41: -17.8
A42: of:=[.A41]+IF([.B41]>=[.B42];1;0) -> 2 | B42: 10 | C42: of:=[.$K42]+16.3 -> -1.1 | D42: of:=[.$K42]-16 -> -33.4 | E42: of:=[.A42] -> 2 | F42: of:=[.B42] -> 10 | G42: of:=[.$K42]+16 -> -1.4 | H42: of:=[.$K42]-15.8 -> -33.2 | I42: of:=[.A42] -> 2 | J42: of:=[.B42] -> 10 | K42: -17.4
A43: of:=[.A42]+IF([.B42]>=[.B43];1;0) -> 2 | B43: 15 | C43: of:=[.$K43]+16.3 -> -0.800000000000001 | D43: of:=[.$K43]-16 -> -33.1 | E43: of:=[.A43] -> 2 | F43: of:=[.B43] -> 15 | G43: of:=[.$K43]+16 -> -1.1 | H43: of:=[.$K43]-15.8 -> -32.9 | I43: of:=[.A43] -> 2 | J43: of:=[.B43] -> 15 | K43: -17.1
A44: of:=[.A43]+IF([.B43]>=[.B44];1;0) -> 2 | B44: 20 | C44: of:=[.$K44]+16.3 -> -0.399999999999999 | D44: of:=[.$K44]-16 -> -32.7 | E44: of:=[.A44] -> 2 | F44: of:=[.B44] -> 20 | G44: of:=[.$K44]+16 -> -0.699999999999999 | H44: of:=[.$K44]-15.8 -> -32.5 | I44: of:=[.A44] -> 2 | J44: of:=[.B44] -> 20 | K44: -16.7
A45: of:=[.A44]+IF([.B44]>=[.B45];1;0) -> 2 | B45: 25 | C45: of:=[.$K45]+16.3 -> -0.0999999999999979 | D45: of:=[.$K45]-16 -> -32.4 | E45: of:=[.A45] -> 2 | F45: of:=[.B45] -> 25 | G45: of:=[.$K45]+16 -> -0.399999999999999 | H45: of:=[.$K45]-15.8 -> -32.2 | I45: of:=[.A45] -> 2 | J45: of:=[.B45] -> 25 | K45: -16.4
A46: of:=[.A45]+IF([.B45]>=[.B46];1;0) -> 2 | B46: 30 | C46: of:=[.$K46]+16.3 -> 0.199999999999999 | D46: of:=[.$K46]-16 -> -32.1 | E46: of:=[.A46] -> 2 | F46: of:=[.B46] -> 30 | G46: of:=[.$K46]+16 -> -0.100000000000001 | H46: of:=[.$K46]-15.8 -> -31.9 | I46: of:=[.A46] -> 2 | J46: of:=[.B46] -> 30 | K46: -16.1
A47: of:=[.A46]+IF([.B46]>=[.B47];1;0) -> 2 | B47: 35 | C47: of:=[.$K47]+16.3 -> 0.5 | D47: of:=[.$K47]-16 -> -31.8 | E47: of:=[.A47] -> 2 | F47: of:=[.B47] -> 35 | G47: of:=[.$K47]+16 -> 0.199999999999999 | H47: of:=[.$K47]-15.8 -> -31.6 | I47: of:=[.A47] -> 2 | J47: of:=[.B47] -> 35 | K47: -15.8
A48: of:=[.A47]+IF([.B47]>=[.B48];1;0) -> 2 | B48: 40 | C48: of:=[.$K48]+16.3 -> 0.9 | D48: of:=[.$K48]-16 -> -31.4 | E48: of:=[.A48] -> 2 | F48: of:=[.B48] -> 40 | G48: of:=[.$K48]+16 -> 0.6 | H48: of:=[.$K48]-15.8 -> -31.2 | I48: of:=[.A48] -> 2 | J48: of:=[.B48] -> 40 | K48: -15.4
A49: of:=[.A48]+IF([.B48]>=[.B49];1;0) -> 2 | B49: 45 | C49: of:=[.$K49]+16.3 -> 1.1 | D49: of:=[.$K49]-16 -> -31.2 | E49: of:=[.A49] -> 2 | F49: of:=[.B49] -> 45 | G49: of:=[.$K49]+16 -> 0.800000000000001 | H49: of:=[.$K49]-15.8 -> -31 | I49: of:=[.A49] -> 2 | J49: of:=[.B49] -> 45 | K49: -15.2
A50: of:=[.A49]+IF([.B49]>=[.B50];1;0) -> 2 | B50: 50 | C50: of:=[.$K50]+16.3 -> 1.4 | D50: of:=[.$K50]-16 -> -30.9 | E50: of:=[.A50] -> 2 | F50: of:=[.B50] -> 50 | G50: of:=[.$K50]+16 -> 1.1 | H50: of:=[.$K50]-15.8 -> -30.7 | I50: of:=[.A50] -> 2 | J50: of:=[.B50] -> 50 | K50: -14.9
A51: of:=[.A50]+IF([.B50]>=[.B51];1;0) -> 2 | B51: 55 | C51: of:=[.$K51]+16.3 -> 1.7 | D51: of:=[.$K51]-16 -> -30.6 | E51: of:=[.A51] -> 2 | F51: of:=[.B51] -> 55 | G51: of:=[.$K51]+16 -> 1.4 | H51: of:=[.$K51]-15.8 -> -30.4 | I51: of:=[.A51] -> 2 | J51: of:=[.B51] -> 55 | K51: -14.6
A52: of:=[.A51]+IF([.B51]>=[.B52];1;0) -> 3 | B52: 0 | C52: of:=[.$K52]+16.3 -> 2 | D52: of:=[.$K52]-16 -> -30.3 | E52: of:=[.A52] -> 3 | F52: of:=[.B52] -> 0 | G52: of:=[.$K52]+16 -> 1.7 | H52: of:=[.$K52]-15.8 -> -30.1 | I52: of:=[.A52] -> 3 | J52: of:=[.B52] -> 0 | K52: -14.3
A53: of:=[.A52]+IF([.B52]>=[.B53];1;0) -> 3 | B53: 5 | C53: of:=[.$K53]+16.3 -> 2.2 | D53: of:=[.$K53]-16 -> -30.1 | E53: of:=[.A53] -> 3 | F53: of:=[.B53] -> 5 | G53: of:=[.$K53]+16 -> 1.9 | H53: of:=[.$K53]-15.8 -> -29.9 | I53: of:=[.A53] -> 3 | J53: of:=[.B53] -> 5 | K53: -14.1
A54: of:=[.A53]+IF([.B53]>=[.B54];1;0) -> 3 | B54: 10 | C54: of:=[.$K54]+16.3 -> 2.5 | D54: of:=[.$K54]-16 -> -29.8 | E54: of:=[.A54] -> 3 | F54: of:=[.B54] -> 10 | G54: of:=[.$K54]+16 -> 2.2 | H54: of:=[.$K54]-15.8 -> -29.6 | I54: of:=[.A54] -> 3 | J54: of:=[.B54] -> 10 | K54: -13.8
A55: of:=[.A54]+IF([.B54]>=[.B55];1;0) -> 3 | B55: 15 | C55: of:=[.$K55]+16.3 -> 2.7 | D55: of:=[.$K55]-16 -> -29.6 | E55: of:=[.A55] -> 3 | F55: of:=[.B55] -> 15 | G55: of:=[.$K55]+16 -> 2.4 | H55: of:=[.$K55]-15.8 -> -29.4 | I55: of:=[.A55] -> 3 | J55: of:=[.B55] -> 15 | K55: -13.6
A56: of:=[.A55]+IF([.B55]>=[.B56];1;0) -> 3 | B56: 20 | C56: of:=[.$K56]+16.3 -> 2.9 | D56: of:=[.$K56]-16 -> -29.4 | E56: of:=[.A56] -> 3 | F56: of:=[.B56] -> 20 | G56: of:=[.$K56]+16 -> 2.6 | H56: of:=[.$K56]-15.8 -> -29.2 | I56: of:=[.A56] -> 3 | J56: of:=[.B56] -> 20 | K56: -13.4
A57: of:=[.A56]+IF([.B56]>=[.B57];1;0) -> 3 | B57: 25 | C57: of:=[.$K57]+16.3 -> 3.2 | D57: of:=[.$K57]-16 -> -29.1 | E57: of:=[.A57] -> 3 | F57: of:=[.B57] -> 25 | G57: of:=[.$K57]+16 -> 2.9 | H57: of:=[.$K57]-15.8 -> -28.9 | I57: of:=[.A57] -> 3 | J57: of:=[.B57] -> 25 | K57: -13.1
A58: of:=[.A57]+IF([.B57]>=[.B58];1;0) -> 3 | B58: 30 | C58: of:=[.$K58]+16.3 -> 3.4 | D58: of:=[.$K58]-16 -> -28.9 | E58: of:=[.A58] -> 3 | F58: of:=[.B58] -> 30 | G58: of:=[.$K58]+16 -> 3.1 | H58: of:=[.$K58]-15.8 -> -28.7 | I58: of:=[.A58] -> 3 | J58: of:=[.B58] -> 30 | K58: -12.9
A59: of:=[.A58]+IF([.B58]>=[.B59];1;0) -> 3 | B59: 35 | C59: of:=[.$K59]+16.3 -> 3.6 | D59: of:=[.$K59]-16 -> -28.7 | E59: of:=[.A59] -> 3 | F59: of:=[.B59] -> 35 | G59: of:=[.$K59]+16 -> 3.3 | H59: of:=[.$K59]-15.8 -> -28.5 | I59: of:=[.A59] -> 3 | J59: of:=[.B59] -> 35 | K59: -12.7
A60: of:=[.A59]+IF([.B59]>=[.B60];1;0) -> 3 | B60: 40 | C60: of:=[.$K60]+16.3 -> 3.8 | D60: of:=[.$K60]-16 -> -28.5 | E60: of:=[.A60] -> 3 | F60: of:=[.B60] -> 40 | G60: of:=[.$K60]+16 -> 3.5 | H60: of:=[.$K60]-15.8 -> -28.3 | I60: of:=[.A60] -> 3 | J60: of:=[.B60] -> 40 | K60: -12.5
A61: of:=[.A60]+IF([.B60]>=[.B61];1;0) -> 3 | B61: 45 | C61: of:=[.$K61]+16.3 -> 15.1 | D61: of:=[.$K61]-16 -> -17.2 | E61: of:=[.A61] -> 3 | F61: of:=[.B61] -> 45 | G61: of:=[.$K61]+16 -> 14.8 | H61: of:=[.$K61]-15.8 -> -17 | I61: of:=[.A61] -> 3 | J61: of:=[.B61] -> 45 | K61: -1.2
A62: of:=[.A61]+IF([.B61]>=[.B62];1;0) -> 3 | B62: 50 | C62: of:=[.$K62]+16.3 -> 4.2 | D62: of:=[.$K62]-16 -> -28.1 | E62: of:=[.A62] -> 3 | F62: of:=[.B62] -> 50 | G62: of:=[.$K62]+16 -> 3.9 | H62: of:=[.$K62]-15.8 -> -27.9 | I62: of:=[.A62] -> 3 | J62: of:=[.B62] -> 50 | K62: -12.1
A63: of:=[.A62]+IF([.B62]>=[.B63];1;0) -> 3 | B63: 55 | C63: of:=[.$K63]+16.3 -> 4.4 | D63: of:=[.$K63]-16 -> -27.9 | E63: of:=[.A63] -> 3 | F63: of:=[.B63] -> 55 | G63: of:=[.$K63]+16 -> 4.1 | H63: of:=[.$K63]-15.8 -> -27.7 | I63: of:=[.A63] -> 3 | J63: of:=[.B63] -> 55 | K63: -11.9
A64: of:=[.A63]+IF([.B63]>=[.B64];1;0) -> 4 | B64: 0 | C64: of:=[.$K64]+16.3 -> 4.6 | D64: of:=[.$K64]-16 -> -27.7 | E64: of:=[.A64] -> 4 | F64: of:=[.B64] -> 0 | G64: of:=[.$K64]+16 -> 4.3 | H64: of:=[.$K64]-15.8 -> -27.5 | I64: of:=[.A64] -> 4 | J64: of:=[.B64] -> 0 | K64: -11.7
A65: of:=[.A64]+IF([.B64]>=[.B65];1;0) -> 4 | B65: 5 | C65: of:=[.$K65]+16.3 -> 4.8 | D65: of:=[.$K65]-16 -> -27.5 | E65: of:=[.A65] -> 4 | F65: of:=[.B65] -> 5 | G65: of:=[.$K65]+16 -> 4.5 | H65: of:=[.$K65]-15.8 -> -27.3 | I65: of:=[.A65] -> 4 | J65: of:=[.B65] -> 5 | K65: -11.5
A66: of:=[.A65]+IF([.B65]>=[.B66];1;0) -> 4 | B66: 10 | C66: of:=[.$K66]+16.3 -> 4.9 | D66: of:=[.$K66]-16 -> -27.4 | E66: of:=[.A66] -> 4 | F66: of:=[.B66] -> 10 | G66: of:=[.$K66]+16 -> 4.6 | H66: of:=[.$K66]-15.8 -> -27.2 | I66: of:=[.A66] -> 4 | J66: of:=[.B66] -> 10 | K66: -11.4
A67: of:=[.A66]+IF([.B66]>=[.B67];1;0) -> 4 | B67: 15 | C67: of:=[.$K67]+16.3 -> 5.1 | D67: of:=[.$K67]-16 -> -27.2 | E67: of:=[.A67] -> 4 | F67: of:=[.B67] -> 15 | G67: of:=[.$K67]+16 -> 4.8 | H67: of:=[.$K67]-15.8 -> -27 | I67: of:=[.A67] -> 4 | J67: of:=[.B67] -> 15 | K67: -11.2
A68: of:=[.A67]+IF([.B67]>=[.B68];1;0) -> 4 | B68: 20 | C68: of:=[.$K68]+16.3 -> 5.3 | D68: of:=[.$K68]-16 -> -27 | E68: of:=[.A68] -> 4 | F68: of:=[.B68] -> 20 | G68: of:=[.$K68]+16 -> 5 | H68: of:=[.$K68]-15.8 -> -26.8 | I68: of:=[.A68] -> 4 | J68: of:=[.B68] -> 20 | K68: -11
A69: of:=[.A68]+IF([.B68]>=[.B69];1;0) -> 4 | B69: 25 | C69: of:=[.$K69]+16.3 -> 5.4 | D69: of:=[.$K69]-16 -> -26.9 | E69: of:=[.A69] -> 4 | F69: of:=[.B69] -> 25 | G69: of:=[.$K69]+16 -> 5.1 | H69: of:=[.$K69]-15.8 -> -26.7 | I69: of:=[.A69] -> 4 | J69: of:=[.B69] -> 25 | K69: -10.9
A70: of:=[.A69]+IF([.B69]>=[.B70];1;0) -> 4 | B70: 30 | C70: of:=[.$K70]+16.3 -> 5.6 | D70: of:=[.$K70]-16 -> -26.7 | E70: of:=[.A70] -> 4 | F70: of:=[.B70] -> 30 | G70: of:=[.$K70]+16 -> 5.3 | H70: of:=[.$K70]-15.8 -> -26.5 | I70: of:=[.A70] -> 4 | J70: of:=[.B70] -> 30 | K70: -10.7
A71: of:=[.A70]+IF([.B70]>=[.B71];1;0) -> 4 | B71: 35 | C71: of:=[.$K71]+16.3 -> 5.7 | D71: of:=[.$K71]-16 -> -26.6 | E71: of:=[.A71] -> 4 | F71: of:=[.B71] -> 35 | G71: of:=[.$K71]+16 -> 5.4 | H71: of:=[.$K71]-15.8 -> -26.4 | I71: of:=[.A71] -> 4 | J71: of:=[.B71] -> 35 | K71: -10.6
A72: of:=[.A71]+IF([.B71]>=[.B72];1;0) -> 4 | B72: 40 | C72: of:=[.$K72]+16.3 -> 5.9 | D72: of:=[.$K72]-16 -> -26.4 | E72: of:=[.A72] -> 4 | F72: of:=[.B72] -> 40 | G72: of:=[.$K72]+16 -> 5.6 | H72: of:=[.$K72]-15.8 -> -26.2 | I72: of:=[.A72] -> 4 | J72: of:=[.B72] -> 40 | K72: -10.4
A73: of:=[.A72]+IF([.B72]>=[.B73];1;0) -> 4 | B73: 45 | C73: of:=[.$K73]+16.3 -> 6 | D73: of:=[.$K73]-16 -> -26.3 | E73: of:=[.A73] -> 4 | F73: of:=[.B73] -> 45 | G73: of:=[.$K73]+16 -> 5.7 | H73: of:=[.$K73]-15.8 -> -26.1 | I73: of:=[.A73] -> 4 | J73: of:=[.B73] -> 45 | K73: -10.3
A74: of:=[.A73]+IF([.B73]>=[.B74];1;0) -> 4 | B74: 50 | C74: of:=[.$K74]+16.3 -> 6.2 | D74: of:=[.$K74]-16 -> -26.1 | E74: of:=[.A74] -> 4 | F74: of:=[.B74] -> 50 | G74: of:=[.$K74]+16 -> 5.9 | H74: of:=[.$K74]-15.8 -> -25.9 | I74: of:=[.A74] -> 4 | J74: of:=[.B74] -> 50 | K74: -10.1
A75: of:=[.A74]+IF([.B74]>=[.B75];1;0) -> 4 | B75: 55 | C75: of:=[.$K75]+16.3 -> 6.3 | D75: of:=[.$K75]-16 -> -26 | E75: of:=[.A75] -> 4 | F75: of:=[.B75] -> 55 | G75: of:=[.$K75]+16 -> 6 | H75: of:=[.$K75]-15.8 -> -25.8 | I75: of:=[.A75] -> 4 | J75: of:=[.B75] -> 55 | K75: -10
A76: of:=[.A75]+IF([.B75]>=[.B76];1;0) -> 5 | B76: 0 | C76: of:=[.$K76]+16.3 -> 6.5 | D76: of:=[.$K76]-16 -> -25.8 | E76: of:=[.A76] -> 5 | F76: of:=[.B76] -> 0 | G76: of:=[.$K76]+16 -> 6.2 | H76: of:=[.$K76]-15.8 -> -25.6 | I76: of:=[.A76] -> 5 | J76: of:=[.B76] -> 0 | K76: -9.8
A77: of:=[.A76]+IF([.B76]>=[.B77];1;0) -> 5 | B77: 5 | C77: of:=[.$K77]+16.3 -> 6.6 | D77: of:=[.$K77]-16 -> -25.7 | E77: of:=[.A77] -> 5 | F77: of:=[.B77] -> 5 | G77: of:=[.$K77]+16 -> 6.3 | H77: of:=[.$K77]-15.8 -> -25.5 | I77: of:=[.A77] -> 5 | J77: of:=[.B77] -> 5 | K77: -9.7
A78: of:=[.A77]+IF([.B77]>=[.B78];1;0) -> 5 | B78: 10 | C78: of:=[.$K78]+16.3 -> 6.7 | D78: of:=[.$K78]-16 -> -25.6 | E78: of:=[.A78] -> 5 | F78: of:=[.B78] -> 10 | G78: of:=[.$K78]+16 -> 6.4 | H78: of:=[.$K78]-15.8 -> -25.4 | I78: of:=[.A78] -> 5 | J78: of:=[.B78] -> 10 | K78: -9.6
A79: of:=[.A78]+IF([.B78]>=[.B79];1;0) -> 5 | B79: 15 | C79: of:=[.$K79]+16.3 -> 6.8 | D79: of:=[.$K79]-16 -> -25.5 | E79: of:=[.A79] -> 5 | F79: of:=[.B79] -> 15 | G79: of:=[.$K79]+16 -> 6.5 | H79: of:=[.$K79]-15.8 -> -25.3 | I79: of:=[.A79] -> 5 | J79: of:=[.B79] -> 15 | K79: -9.5
A80: of:=[.A79]+IF([.B79]>=[.B80];1;0) -> 5 | B80: 20 | C80: of:=[.$K80]+16.3 -> 7 | D80: of:=[.$K80]-16 -> -25.3 | E80: of:=[.A80] -> 5 | F80: of:=[.B80] -> 20 | G80: of:=[.$K80]+16 -> 6.7 | H80: of:=[.$K80]-15.8 -> -25.1 | I80: of:=[.A80] -> 5 | J80: of:=[.B80] -> 20 | K80: -9.3
A81: of:=[.A80]+IF([.B80]>=[.B81];1;0) -> 5 | B81: 25 | C81: of:=[.$K81]+16.3 -> 7.1 | D81: of:=[.$K81]-16 -> -25.2 | E81: of:=[.A81] -> 5 | F81: of:=[.B81] -> 25 | G81: of:=[.$K81]+16 -> 6.8 | H81: of:=[.$K81]-15.8 -> -25 | I81: of:=[.A81] -> 5 | J81: of:=[.B81] -> 25 | K81: -9.2
A82: of:=[.A81]+IF([.B81]>=[.B82];1;0) -> 5 | B82: 30 | C82: of:=[.$K82]+16.3 -> 7.2 | D82: of:=[.$K82]-16 -> -25.1 | E82: of:=[.A82] -> 5 | F82: of:=[.B82] -> 30 | G82: of:=[.$K82]+16 -> 6.9 | H82: of:=[.$K82]-15.8 -> -24.9 | I82: of:=[.A82] -> 5 | J82: of:=[.B82] -> 30 | K82: -9.1
A83: of:=[.A82]+IF([.B82]>=[.B83];1;0) -> 5 | B83: 35 | C83: of:=[.$K83]+16.3 -> 7.3 | D83: of:=[.$K83]-16 -> -25 | E83: of:=[.A83] -> 5 | F83: of:=[.B83] -> 35 | G83: of:=[.$K83]+16 -> 7 | H83: of:=[.$K83]-15.8 -> -24.8 | I83: of:=[.A83] -> 5 | J83: of:=[.B83] -> 35 | K83: -9
A84: of:=[.A83]+IF([.B83]>=[.B84];1;0) -> 5 | B84: 40 | C84: of:=[.$K84]+16.3 -> 7.4 | D84: of:=[.$K84]-16 -> -24.9 | E84: of:=[.A84] -> 5 | F84: of:=[.B84] -> 40 | G84: of:=[.$K84]+16 -> 7.1 | H84: of:=[.$K84]-15.8 -> -24.7 | I84: of:=[.A84] -> 5 | J84: of:=[.B84] -> 40 | K84: -8.9
A85: of:=[.A84]+IF([.B84]>=[.B85];1;0) -> 5 | B85: 45 | C85: of:=[.$K85]+16.3 -> 7.5 | D85: of:=[.$K85]-16 -> -24.8 | E85: of:=[.A85] -> 5 | F85: of:=[.B85] -> 45 | G85: of:=[.$K85]+16 -> 7.2 | H85: of:=[.$K85]-15.8 -> -24.6 | I85: of:=[.A85] -> 5 | J85: of:=[.B85] -> 45 | K85: -8.8
A86: of:=[.A85]+IF([.B85]>=[.B86];1;0) -> 5 | B86: 50 | C86: of:=[.$K86]+16.3 -> 7.6 | D86: of:=[.$K86]-16 -> -24.7 | E86: of:=[.A86] -> 5 | F86: of:=[.B86] -> 50 | G86: of:=[.$K86]+16 -> 7.3 | H86: of:=[.$K86]-15.8 -> -24.5 | I86: of:=[.A86] -> 5 | J86: of:=[.B86] -> 50 | K86: -8.7
A87: of:=[.A86]+IF([.B86]>=[.B87];1;0) -> 5 | B87: 55 | C87: of:=[.$K87]+16.3 -> 7.7 | D87: of:=[.$K87]-16 -> -24.6 | E87: of:=[.A87] -> 5 | F87: of:=[.B87] -> 55 | G87: of:=[.$K87]+16 -> 7.4 | H87: of:=[.$K87]-15.8 -> -24.4 | I87: of:=[.A87] -> 5 | J87: of:=[.B87] -> 55 | K87: -8.6
A88: of:=[.A87]+IF([.B87]>=[.B88];1;0) -> 6 | B88: 0 | C88: of:=[.$K88]+16.3 -> 7.8 | D88: of:=[.$K88]-16 -> -24.5 | E88: of:=[.A88] -> 6 | F88: of:=[.B88] -> 0 | G88: of:=[.$K88]+16 -> 7.5 | H88: of:=[.$K88]-15.8 -> -24.3 | I88: of:=[.A88] -> 6 | J88: of:=[.B88] -> 0 | K88: -8.5
A89: of:=[.A88]+IF([.B88]>=[.B89];1;0) -> 6 | B89: 10 | C89: of:=[.$K89]+16.3 -> 8 | D89: of:=[.$K89]-16 -> -24.3 | E89: of:=[.A89] -> 6 | F89: of:=[.B89] -> 10 | G89: of:=[.$K89]+16 -> 7.7 | H89: of:=[.$K89]-15.8 -> -24.1 | I89: of:=[.A89] -> 6 | J89: of:=[.B89] -> 10 | K89: -8.3
A90: of:=[.A89]+IF([.B89]>=[.B90];1;0) -> 6 | B90: 20 | C90: of:=[.$K90]+16.3 -> 8.2 | D90: of:=[.$K90]-16 -> -24.1 | E90: of:=[.A90] -> 6 | F90: of:=[.B90] -> 20 | G90: of:=[.$K90]+16 -> 7.9 | H90: of:=[.$K90]-15.8 -> -23.9 | I90: of:=[.A90] -> 6 | J90: of:=[.B90] -> 20 | K90: -8.1
A91: of:=[.A90]+IF([.B90]>=[.B91];1;0) -> 6 | B91: 30 | C91: of:=[.$K91]+16.3 -> 8.4 | D91: of:=[.$K91]-16 -> -23.9 | E91: of:=[.A91] -> 6 | F91: of:=[.B91] -> 30 | G91: of:=[.$K91]+16 -> 8.1 | H91: of:=[.$K91]-15.8 -> -23.7 | I91: of:=[.A91] -> 6 | J91: of:=[.B91] -> 30 | K91: -7.9
A92: of:=[.A91]+IF([.B91]>=[.B92];1;0) -> 6 | B92: 40 | C92: of:=[.$K92]+16.3 -> 8.6 | D92: of:=[.$K92]-16 -> -23.7 | E92: of:=[.A92] -> 6 | F92: of:=[.B92] -> 40 | G92: of:=[.$K92]+16 -> 8.3 | H92: of:=[.$K92]-15.8 -> -23.5 | I92: of:=[.A92] -> 6 | J92: of:=[.B92] -> 40 | K92: -7.7
A93: of:=[.A92]+IF([.B92]>=[.B93];1;0) -> 6 | B93: 50 | C93: of:=[.$K93]+16.3 -> 8.7 | D93: of:=[.$K93]-16 -> -23.6 | E93: of:=[.A93] -> 6 | F93: of:=[.B93] -> 50 | G93: of:=[.$K93]+16 -> 8.4 | H93: of:=[.$K93]-15.8 -> -23.4 | I93: of:=[.A93] -> 6 | J93: of:=[.B93] -> 50 | K93: -7.6
A94: of:=[.A93]+IF([.B93]>=[.B94];1;0) -> 7 | B94: 0 | C94: of:=[.$K94]+16.3 -> 8.9 | D94: of:=[.$K94]-16 -> -23.4 | E94: of:=[.A94] -> 7 | F94: of:=[.B94] -> 0 | G94: of:=[.$K94]+16 -> 8.6 | H94: of:=[.$K94]-15.8 -> -23.2 | I94: of:=[.A94] -> 7 | J94: of:=[.B94] -> 0 | K94: -7.4
A95: of:=[.A94]+IF([.B94]>=[.B95];1;0) -> 7 | B95: 10 | C95: of:=[.$K95]+16.3 -> 9.1 | D95: of:=[.$K95]-16 -> -23.2 | E95: of:=[.A95] -> 7 | F95: of:=[.B95] -> 10 | G95: of:=[.$K95]+16 -> 8.8 | H95: of:=[.$K95]-15.8 -> -23 | I95: of:=[.A95] -> 7 | J95: of:=[.B95] -> 10 | K95: -7.2
A96: of:=[.A95]+IF([.B95]>=[.B96];1;0) -> 7 | B96: 20 | C96: of:=[.$K96]+16.3 -> 9.2 | D96: of:=[.$K96]-16 -> -23.1 | E96: of:=[.A96] -> 7 | F96: of:=[.B96] -> 20 | G96: of:=[.$K96]+16 -> 8.9 | H96: of:=[.$K96]-15.8 -> -22.9 | I96: of:=[.A96] -> 7 | J96: of:=[.B96] -> 20 | K96: -7.1
A97: of:=[.A96]+IF([.B96]>=[.B97];1;0) -> 7 | B97: 30 | C97: of:=[.$K97]+16.3 -> 9.4 | D97: of:=[.$K97]-16 -> -22.9 | E97: of:=[.A97] -> 7 | F97: of:=[.B97] -> 30 | G97: of:=[.$K97]+16 -> 9.1 | H97: of:=[.$K97]-15.8 -> -22.7 | I97: of:=[.A97] -> 7 | J97: of:=[.B97] -> 30 | K97: -6.9
A98: of:=[.A97]+IF([.B97]>=[.B98];1;0) -> 7 | B98: 40 | C98: of:=[.$K98]+16.3 -> 9.5 | D98: of:=[.$K98]-16 -> -22.8 | E98: of:=[.A98] -> 7 | F98: of:=[.B98] -> 40 | G98: of:=[.$K98]+16 -> 9.2 | H98: of:=[.$K98]-15.8 -> -22.6 | I98: of:=[.A98] -> 7 | J98: of:=[.B98] -> 40 | K98: -6.8
A99: of:=[.A98]+IF([.B98]>=[.B99];1;0) -> 7 | B99: 50 | C99: of:=[.$K99]+16.3 -> 9.6 | D99: of:=[.$K99]-16 -> -22.7 | E99: of:=[.A99] -> 7 | F99: of:=[.B99] -> 50 | G99: of:=[.$K99]+16 -> 9.3 | H99: of:=[.$K99]-15.8 -> -22.5 | I99: of:=[.A99] -> 7 | J99: of:=[.B99] -> 50 | K99: -6.7
A100: of:=[.A99]+IF([.B99]>=[.B100];1;0) -> 8 | B100: 0 | C100: of:=[.$K100]+16.3 -> 9.7 | D100: of:=[.$K100]-16 -> -22.6 | E100: of:=[.A100] -> 8 | F100: of:=[.B100] -> 0 | G100: of:=[.$K100]+16 -> 9.4 | H100: of:=[.$K100]-15.8 -> -22.4 | I100: of:=[.A100] -> 8 | J100: of:=[.B100] -> 0 | K100: -6.6
A101: of:=[.A100]+IF([.B100]>=[.B101];1;0) -> 8 | B101: 10 | C101: of:=[.$K101]+16.3 -> 9.9 | D101: of:=[.$K101]-16 -> -22.4 | E101: of:=[.A101] -> 8 | F101: of:=[.B101] -> 10 | G101: of:=[.$K101]+16 -> 9.6 | H101: of:=[.$K101]-15.8 -> -22.2 | I101: of:=[.A101] -> 8 | J101: of:=[.B101] -> 10 | K101: -6.4
A102: of:=[.A101]+IF([.B101]>=[.B102];1;0) -> 8 | B102: 20 | C102: of:=[.$K102]+16.3 -> 10 | D102: of:=[.$K102]-16 -> -22.3 | E102: of:=[.A102] -> 8 | F102: of:=[.B102] -> 20 | G102: of:=[.$K102]+16 -> 9.7 | H102: of:=[.$K102]-15.8 -> -22.1 | I102: of:=[.A102] -> 8 | J102: of:=[.B102] -> 20 | K102: -6.3
A103: of:=[.A102]+IF([.B102]>=[.B103];1;0) -> 8 | B103: 30 | C103: of:=[.$K103]+16.3 -> 10.1 | D103: of:=[.$K103]-16 -> -22.2 | E103: of:=[.A103] -> 8 | F103: of:=[.B103] -> 30 | G103: of:=[.$K103]+16 -> 9.8 | H103: of:=[.$K103]-15.8 -> -22 | I103: of:=[.A103] -> 8 | J103: of:=[.B103] -> 30 | K103: -6.2
A104: of:=[.A103]+IF([.B103]>=[.B104];1;0) -> 8 | B104: 40 | C104: of:=[.$K104]+16.3 -> 10.2 | D104: of:=[.$K104]-16 -> -22.1 | E104: of:=[.A104] -> 8 | F104: of:=[.B104] -> 40 | G104: of:=[.$K104]+16 -> 9.9 | H104: of:=[.$K104]-15.8 -> -21.9 | I104: of:=[.A104] -> 8 | J104: of:=[.B104] -> 40 | K104: -6.1
A105: of:=[.A104]+IF([.B104]>=[.B105];1;0) -> 8 | B105: 50 | C105: of:=[.$K105]+16.3 -> 10.3 | D105: of:=[.$K105]-16 -> -22 | E105: of:=[.A105] -> 8 | F105: of:=[.B105] -> 50 | G105: of:=[.$K105]+16 -> 10 | H105: of:=[.$K105]-15.8 -> -21.8 | I105: of:=[.A105] -> 8 | J105: of:=[.B105] -> 50 | K105: -6
A106: of:=[.A105]+IF([.B105]>=[.B106];1;0) -> 9 | B106: 0 | C106: of:=[.$K106]+16.3 -> 10.4 | D106: of:=[.$K106]-16 -> -21.9 | E106: of:=[.A106] -> 9 | F106: of:=[.B106] -> 0 | G106: of:=[.$K106]+16 -> 10.1 | H106: of:=[.$K106]-15.8 -> -21.7 | I106: of:=[.A106] -> 9 | J106: of:=[.B106] -> 0 | K106: -5.9
A107: of:=[.A106]+IF([.B106]>=[.B107];1;0) -> 9 | B107: 10 | C107: of:=[.$K107]+16.3 -> 10.5 | D107: of:=[.$K107]-16 -> -21.8 | E107: of:=[.A107] -> 9 | F107: of:=[.B107] -> 10 | G107: of:=[.$K107]+16 -> 10.2 | H107: of:=[.$K107]-15.8 -> -21.6 | I107: of:=[.A107] -> 9 | J107: of:=[.B107] -> 10 | K107: -5.8
A108: of:=[.A107]+IF([.B107]>=[.B108];1;0) -> 9 | B108: 20 | C108: of:=[.$K108]+16.3 -> 10.6 | D108: of:=[.$K108]-16 -> -21.7 | E108: of:=[.A108] -> 9 | F108: of:=[.B108] -> 20 | G108: of:=[.$K108]+16 -> 10.3 | H108: of:=[.$K108]-15.8 -> -21.5 | I108: of:=[.A108] -> 9 | J108: of:=[.B108] -> 20 | K108: -5.7
A109: of:=[.A108]+IF([.B108]>=[.B109];1;0) -> 9 | B109: 30 | C109: of:=[.$K109]+16.3 -> 10.7 | D109: of:=[.$K109]-16 -> -21.6 | E109: of:=[.A109] -> 9 | F109: of:=[.B109] -> 30 | G109: of:=[.$K109]+16 -> 10.4 | H109: of:=[.$K109]-15.8 -> -21.4 | I109: of:=[.A109] -> 9 | J109: of:=[.B109] -> 30 | K109: -5.6
A110: of:=[.A109]+IF([.B109]>=[.B110];1;0) -> 9 | B110: 40 | C110: of:=[.$K110]+16.3 -> 10.8 | D110: of:=[.$K110]-16 -> -21.5 | E110: of:=[.A110] -> 9 | F110: of:=[.B110] -> 40 | G110: of:=[.$K110]+16 -> 10.5 | H110: of:=[.$K110]-15.8 -> -21.3 | I110: of:=[.A110] -> 9 | J110: of:=[.B110] -> 40 | K110: -5.5
A111: of:=[.A110]+IF([.B110]>=[.B111];1;0) -> 9 | B111: 50 | C111: of:=[.$K111]+16.3 -> 10.9 | D111: of:=[.$K111]-16 -> -21.4 | E111: of:=[.A111] -> 9 | F111: of:=[.B111] -> 50 | G111: of:=[.$K111]+16 -> 10.6 | H111: of:=[.$K111]-15.8 -> -21.2 | I111: of:=[.A111] -> 9 | J111: of:=[.B111] -> 50 | K111: -5.4
A112: 10 | B112: 0 | C112: of:=[.$K112]+16.3 -> 11 | D112: of:=[.$K112]-16 -> -21.3 | E112: of:=[.A112] -> 10 | F112: of:=[.B112] -> 0 | G112: of:=[.$K112]+16 -> 10.7 | H112: of:=[.$K112]-15.8 -> -21.1 | I112: of:=[.A112] -> 10 | J112: of:=[.B112] -> 0 | K112: -5.3
A114: 9 | B114: 33 | C114: 10.8 | D114: -21.5 | E114: 9 | F114: 39 | G114: 10.6 | H114: -21.2 | I114: 9 | J114: 55 | K114: -5.3
A115: of:=[.A114]+IF([.B114]>=[.B115];1;0) -> 9 | B115: 45 | C115: of:=[.C114]+0.1 -> 10.9 | D115: of:=[.D114]+0.1 -> -21.4 | E115: of:=[.E114]+IF([.F114]>=[.F115];1;0) -> 9 | F115: 50 | G115: 10.7 | H115: -21.1 | I115: of:=[.I114]+IF([.J114]>=[.J115];1;0) -> 10 | J115: 7 | K115: -5.2
A116: of:=[.A115]+IF([.B115]>=[.B116];1;0) -> 9 | B116: 56 | C116: of:=[.C115]+0.1 -> 11 | D116: of:=[.D115]+0.1 -> -21.3 | E116: of:=[.E115]+IF([.F115]>=[.F116];1;0) -> 10 | F116: 2 | G116: 10.8 | H116: -21 | I116: of:=[.I115]+IF([.J115]>=[.J116];1;0) -> 10 | J116: 20 | K116: -5.1
A117: of:=[.A116]+IF([.B116]>=[.B117];1;0) -> 10 | B117: 8 | C117: of:=[.C116]+0.1 -> 11.1 | D117: of:=[.D116]+0.1 -> -21.2 | E117: of:=[.E116]+IF([.F116]>=[.F117];1;0) -> 10 | F117: 14 | G117: 10.9 | H117: -20.9 | I117: of:=[.I116]+IF([.J116]>=[.J117];1;0) -> 10 | J117: 32 | K117: -5
A118: of:=[.A117]+IF([.B117]>=[.B118];1;0) -> 10 | B118: 20 | C118: of:=[.C117]+0.1 -> 11.2 | D118: of:=[.D117]+0.1 -> -21.1 | E118: of:=[.E117]+IF([.F117]>=[.F118];1;0) -> 10 | F118: 27 | G118: 11 | H118: -20.8 | I118: of:=[.I117]+IF([.J117]>=[.J118];1;0) -> 10 | J118: 46 | K118: -4.9
A119: of:=[.A118]+IF([.B118]>=[.B119];1;0) -> 10 | B119: 33 | C119: of:=[.C118]+0.1 -> 11.3 | D119: of:=[.D118]+0.1 -> -21 | E119: of:=[.E118]+IF([.F118]>=[.F119];1;0) -> 10 | F119: 40 | G119: 11.1 | H119: -20.7 | I119: of:=[.I118]+IF([.J118]>=[.J119];1;0) -> 10 | J119: 59 | K119: -4.8
A120: of:=[.A119]+IF([.B119]>=[.B120];1;0) -> 10 | B120: 46 | C120: of:=[.C119]+0.1 -> 11.4 | D120: of:=[.D119]+0.1 -> -20.9 | E120: of:=[.E119]+IF([.F119]>=[.F120];1;0) -> 10 | F120: 53 | G120: 11.2 | H120: -20.6 | I120: of:=[.I119]+IF([.J119]>=[.J120];1;0) -> 11 | J120: 14 | K120: -4.7
A121: of:=[.A120]+IF([.B120]>=[.B121];1;0) -> 11 | B121: 0 | C121: of:=[.C120]+0.1 -> 11.5 | D121: of:=[.D120]+0.1 -> -20.8 | E121: of:=[.E120]+IF([.F120]>=[.F121];1;0) -> 11 | F121: 7 | G121: 11.3 | H121: -20.5 | I121: of:=[.I120]+IF([.J120]>=[.J121];1;0) -> 11 | J121: 29 | K121: -4.6
A122: of:=[.A121]+IF([.B121]>=[.B122];1;0) -> 11 | B122: 15 | C122: of:=[.C121]+0.1 -> 11.6 | D122: of:=[.D121]+0.1 -> -20.7 | E122: of:=[.E121]+IF([.F121]>=[.F122];1;0) -> 11 | F122: 22 | G122: 11.4 | H122: -20.4 | I122: of:=[.I121]+IF([.J121]>=[.J122];1;0) -> 11 | J122: 44 | K122: -4.5
A123: of:=[.A122]+IF([.B122]>=[.B123];1;0) -> 11 | B123: 30 | C123: of:=[.C122]+0.1 -> 11.7 | D123: of:=[.D122]+0.1 -> -20.6 | E123: of:=[.E122]+IF([.F122]>=[.F123];1;0) -> 11 | F123: 37 | G123: 11.5 | H123: -20.3 | I123: of:=[.I122]+IF([.J122]>=[.J123];1;0) -> 12 | J123: 0 | K123: -4.4
A124: of:=[.A123]+IF([.B123]>=[.B124];1;0) -> 11 | B124: 45 | C124: of:=[.C123]+0.1 -> 11.8 | D124: of:=[.D123]+0.1 -> -20.5 | E124: of:=[.E123]+IF([.F123]>=[.F124];1;0) -> 11 | F124: 53 | G124: 11.6 | H124: -20.2 | I124: of:=[.I123]+IF([.J123]>=[.J124];1;0) -> 12 | J124: 17 | K124: -4.3
A125: of:=[.A124]+IF([.B124]>=[.B125];1;0) -> 12 | B125: 1 | C125: of:=[.C124]+0.1 -> 11.9 | D125: of:=[.D124]+0.1 -> -20.4 | E125: of:=[.E124]+IF([.F124]>=[.F125];1;0) -> 12 | F125: 10 | G125: 11.7 | H125: -20.1 | I125: of:=[.I124]+IF([.J124]>=[.J125];1;0) -> 12 | J125: 35 | K125: -4.2
A126: of:=[.A125]+IF([.B125]>=[.B126];1;0) -> 12 | B126: 18 | C126: of:=[.C125]+0.1 -> 12 | D126: of:=[.D125]+0.1 -> -20.3 | E126: of:=[.E125]+IF([.F125]>=[.F126];1;0) -> 12 | F126: 27 | G126: 11.8 | H126: -20 | I126: of:=[.I125]+IF([.J125]>=[.J126];1;0) -> 12 | J126: 53 | K126: -4.1
A127: of:=[.A126]+IF([.B126]>=[.B127];1;0) -> 12 | B127: 36 | C127: of:=[.C126]+0.1 -> 12.1 | D127: of:=[.D126]+0.1 -> -20.2 | E127: of:=[.E126]+IF([.F126]>=[.F127];1;0) -> 12 | F127: 45 | G127: 11.9 | H127: -19.9 | I127: of:=[.I126]+IF([.J126]>=[.J127];1;0) -> 13 | J127: 12 | K127: -4
A128: of:=[.A127]+IF([.B127]>=[.B128];1;0) -> 12 | B128: 54 | C128: of:=[.C127]+0.1 -> 12.2 | D128: of:=[.D127]+0.1 -> -20.1 | E128: of:=[.E127]+IF([.F127]>=[.F128];1;0) -> 13 | F128: 4 | G128: 12 | H128: -19.8 | I128: of:=[.I127]+IF([.J127]>=[.J128];1;0) -> 13 | J128: 32 | K128: -3.9
A129: of:=[.A128]+IF([.B128]>=[.B129];1;0) -> 13 | B129: 14 | C129: of:=[.C128]+0.1 -> 12.3 | D129: of:=[.D128]+0.1 -> -20 | E129: of:=[.E128]+IF([.F128]>=[.F129];1;0) -> 13 | F129: 24 | G129: 12.1 | H129: -19.7 | I129: of:=[.I128]+IF([.J128]>=[.J129];1;0) -> 13 | J129: 53 | K129: -3.8
A130: of:=[.A129]+IF([.B129]>=[.B130];1;0) -> 13 | B130: 34 | C130: of:=[.C129]+0.1 -> 12.4 | D130: of:=[.D129]+0.1 -> -19.9 | E130: of:=[.E129]+IF([.F129]>=[.F130];1;0) -> 13 | F130: 44 | G130: 12.2 | H130: -19.6 | I130: of:=[.I129]+IF([.J129]>=[.J130];1;0) -> 14 | J130: 16 | K130: -3.7
A131: of:=[.A130]+IF([.B130]>=[.B131];1;0) -> 13 | B131: 55 | C131: of:=[.C130]+0.1 -> 12.5 | D131: of:=[.D130]+0.1 -> -19.8 | E131: of:=[.E130]+IF([.F130]>=[.F131];1;0) -> 14 | F131: 6 | G131: 12.3 | H131: -19.5 | I131: of:=[.I130]+IF([.J130]>=[.J131];1;0) -> 14 | J131: 39 | K131: -3.6
A132: of:=[.A131]+IF([.B131]>=[.B132];1;0) -> 14 | B132: 17 | C132: of:=[.C131]+0.1 -> 12.6 | D132: of:=[.D131]+0.1 -> -19.7 | E132: of:=[.E131]+IF([.F131]>=[.F132];1;0) -> 14 | F132: 29 | G132: 12.4 | H132: -19.4 | I132: of:=[.I131]+IF([.J131]>=[.J132];1;0) -> 15 | J132: 3 | K132: -3.5
A133: of:=[.A132]+IF([.B132]>=[.B133];1;0) -> 14 | B133: 41 | C133: of:=[.C132]+0.1 -> 12.7 | D133: of:=[.D132]+0.1 -> -19.6 | E133: of:=[.E132]+IF([.F132]>=[.F133];1;0) -> 14 | F133: 53 | G133: 12.5 | H133: -19.3 | I133: of:=[.I132]+IF([.J132]>=[.J133];1;0) -> 15 | J133: 29 | K133: -3.4
A134: of:=[.A133]+IF([.B133]>=[.B134];1;0) -> 15 | B134: 5 | C134: of:=[.C133]+0.1 -> 12.8 | D134: of:=[.D133]+0.1 -> -19.5 | E134: of:=[.E133]+IF([.F133]>=[.F134];1;0) -> 15 | F134: 18 | G134: 12.6 | H134: -19.2 | I134: of:=[.I133]+IF([.J133]>=[.J134];1;0) -> 15 | J134: 56 | K134: -3.3
A135: of:=[.A134]+IF([.B134]>=[.B135];1;0) -> 15 | B135: 31 | C135: of:=[.C134]+0.1 -> 12.9 | D135: of:=[.D134]+0.1 -> -19.4 | E135: of:=[.E134]+IF([.F134]>=[.F135];1;0) -> 15 | F135: 45 | G135: 12.7 | H135: -19.1 | I135: of:=[.I134]+IF([.J134]>=[.J135];1;0) -> 16 | J135: 25 | K135: -3.2
A136: of:=[.A135]+IF([.B135]>=[.B136];1;0) -> 15 | B136: 59 | C136: of:=[.C135]+0.1 -> 13 | D136: of:=[.D135]+0.1 -> -19.3 | E136: of:=[.E135]+IF([.F135]>=[.F136];1;0) -> 16 | F136: 13 | G136: 12.8 | H136: -19 | I136: of:=[.I135]+IF([.J135]>=[.J136];1;0) -> 16 | J136: 55 | K136: -3.1
A137: of:=[.A136]+IF([.B136]>=[.B137];1;0) -> 16 | B137: 27 | C137: of:=[.C136]+0.1 -> 13.1 | D137: of:=[.D136]+0.1 -> -19.2 | E137: of:=[.E136]+IF([.F136]>=[.F137];1;0) -> 16 | F137: 43 | G137: 12.9 | H137: -18.9 | I137: of:=[.I136]+IF([.J136]>=[.J137];1;0) -> 17 | J137: 27 | K137: -3
A138: of:=[.A137]+IF([.B137]>=[.B138];1;0) -> 16 | B138: 58 | C138: of:=[.C137]+0.1 -> 13.2 | D138: of:=[.D137]+0.1 -> -19.1 | E138: of:=[.E137]+IF([.F137]>=[.F138];1;0) -> 17 | F138: 14 | G138: 13 | H138: -18.8 | I138: of:=[.I137]+IF([.J137]>=[.J138];1;0) -> 18 | J138: 1 | K138: -2.9
A139: of:=[.A138]+IF([.B138]>=[.B139];1;0) -> 17 | B139: 30 | C139: of:=[.C138]+0.1 -> 13.3 | D139: of:=[.D138]+0.1 -> -19 | E139: of:=[.E138]+IF([.F138]>=[.F139];1;0) -> 17 | F139: 47 | G139: 13.1 | H139: -18.7 | I139: of:=[.I138]+IF([.J138]>=[.J139];1;0) -> 18 | J139: 37 | K139: -2.8
A140: of:=[.A139]+IF([.B139]>=[.B140];1;0) -> 18 | B140: 5 | C140: of:=[.C139]+0.1 -> 13.4 | D140: of:=[.D139]+0.1 -> -18.9 | E140: of:=[.E139]+IF([.F139]>=[.F140];1;0) -> 18 | F140: 23 | G140: 13.2 | H140: -18.6 | I140: of:=[.I139]+IF([.J139]>=[.J140];1;0) -> 19 | J140: 16 | K140: -2.7
A141: of:=[.A140]+IF([.B140]>=[.B141];1;0) -> 18 | B141: 41 | C141: of:=[.C140]+0.1 -> 13.5 | D141: of:=[.D140]+0.1 -> -18.8 | E141: of:=[.E140]+IF([.F140]>=[.F141];1;0) -> 19 | F141: 0 | G141: 13.3 | H141: -18.5 | I141: of:=[.I140]+IF([.J140]>=[.J141];1;0) -> 19 | J141: 56 | K141: -2.6
A142: of:=[.A141]+IF([.B141]>=[.B142];1;0) -> 19 | B142: 20 | C142: of:=[.C141]+0.1 -> 13.6 | D142: of:=[.D141]+0.1 -> -18.7 | E142: of:=[.E141]+IF([.F141]>=[.F142];1;0) -> 19 | F142: 41 | G142: 13.4 | H142: -18.4 | I142: of:=[.I141]+IF([.J141]>=[.J142];1;0) -> 20 | J142: 40 | K142: -2.5
A143: of:=[.A142]+IF([.B142]>=[.B143];1;0) -> 20 | B143: 2 | C143: of:=[.C142]+0.1 -> 13.7 | D143: of:=[.D142]+0.1 -> -18.6 | E143: of:=[.E142]+IF([.F142]>=[.F143];1;0) -> 20 | F143: 24 | G143: 13.5 | H143: -18.3 | I143: of:=[.I142]+IF([.J142]>=[.J143];1;0) -> 21 | J143: 27 | K143: -2.4
A144: of:=[.A143]+IF([.B143]>=[.B144];1;0) -> 20 | B144: 46 | C144: of:=[.C143]+0.1 -> 13.8 | D144: of:=[.D143]+0.1 -> -18.5 | E144: of:=[.E143]+IF([.F143]>=[.F144];1;0) -> 21 | F144: 10 | G144: 13.6 | H144: -18.2 | I144: of:=[.I143]+IF([.J143]>=[.J144];1;0) -> 22 | J144: 17 | K144: -2.3
A145: of:=[.A144]+IF([.B144]>=[.B145];1;0) -> 21 | B145: 34 | C145: of:=[.C144]+0.1 -> 13.9 | D145: of:=[.D144]+0.1 -> -18.4 | E145: of:=[.E144]+IF([.F144]>=[.F145];1;0) -> 21 | F145: 59 | G145: 13.7 | H145: -18.1 | I145: of:=[.I144]+IF([.J144]>=[.J145];1;0) -> 23 | J145: 11 | K145: -2.2
A146: of:=[.A145]+IF([.B145]>=[.B146];1;0) -> 22 | B146: 25 | C146: of:=[.C145]+0.1 -> 14 | D146: of:=[.D145]+0.1 -> -18.3 | E146: of:=[.E145]+IF([.F145]>=[.F146];1;0) -> 22 | F146: 52 | G146: 13.8 | H146: -18 | I146: of:=[.I145]+IF([.J145]>=[.J146];1;0) -> 24 | J146: 9 | K146: -2.1
A147: of:=[.A146]+IF([.B146]>=[.B147];1;0) -> 23 | B147: 20 | C147: of:=[.C146]+0.1 -> 14.1 | D147: of:=[.D146]+0.1 -> -18.2 | E147: of:=[.E146]+IF([.F146]>=[.F147];1;0) -> 23 | F147: 49 | G147: 13.9 | H147: -17.9 | I147: 25 | J147: 12 | K147: -2
A148: of:=[.A147]+IF([.B147]>=[.B148];1;0) -> 24 | B148: 20 | C148: of:=[.C147]+0.1 -> 14.2 | D148: of:=[.D147]+0.1 -> -18.1 | E148: 24 | F148: 51 | G148: 14 | H148: -17.8 | I148: 26 | J148: 20 | K148: -1.9
A149: 25 | B149: 24 | C149: of:=[.C148]+0.1 -> 14.3 | D149: of:=[.D148]+0.1 -> -18 | E149: 25 | F149: 58 | G149: 14.1 | H149: -17.7 | I149: 27 | J149: 34 | K149: -1.8
A150: 26 | B150: 34 | C150: of:=[.C149]+0.1 -> 14.4 | D150: of:=[.D149]+0.1 -> -17.9 | E150: 27 | F150: 11 | G150: 14.2 | H150: -17.6 | I150: 28 | J150: 54 | K150: -1.7
A151: 27 | B151: 50 | C151: of:=[.C150]+0.1 -> 14.5 | D151: of:=[.D150]+0.1 -> -17.7999999999999 | E151: 28 | F151: 31 | G151: 14.3 | H151: -17.5 | I151: 30 | J151: 22 | K151: -1.6
A152: 29 | B152: 13 | C152: of:=[.C151]+0.1 -> 14.6 | D152: of:=[.D151]+0.1 -> -17.6999999999999 | E152: 29 | F152: 58 | G152: 14.4 | H152: -17.4 | I152: 31 | J152: 58 | K152: -1.5
A153: 30 | B153: 44 | C153: of:=[.C152]+0.1 -> 14.7 | D153: of:=[.D152]+0.1 -> -17.5999999999999 | E153: 31 | F153: 33 | G153: 14.5 | H153: -17.3 | I153: 33 | J153: 43 | K153: -1.4
A154: 32 | B154: 24 | C154: of:=[.C153]+0.1 -> 14.8 | D154: of:=[.D153]+0.1 -> -17.4999999999999 | E154: 33 | F154: 18 | G154: 14.6 | H154: -17.2 | I154: 35 | J154: 38 | K154: -1.3
A155: 34 | B155: 15 | C155: of:=[.C154]+0.1 -> 14.9 | D155: of:=[.D154]+0.1 -> -17.3999999999999 | E155: 35 | F155: 15 | G155: 14.7 | H155: -17.1 | I155: 37 | J155: 45 | K155: -1.2
A156: 36 | B156: 17 | C156: of:=[.C155]+0.1 -> 15 | D156: of:=[.D155]+0.1 -> -17.2999999999999 | E156: 37 | F156: 24 | G156: 14.8 | H156: -17 | I156: 40 | J156: 6 | K156: -1.1
A157: 38 | B157: 34 | C157: of:=[.C156]+0.1 -> 15.1 | D157: of:=[.D156]+0.1 -> -17.1999999999999 | E157: 39 | F157: 48 | G157: 14.9 | H157: -16.9 | I157: 42 | J157: 42 | K157: -1
A158: 41 | B158: 6 | C158: of:=[.C157]+0.1 -> 15.2 | D158: of:=[.D157]+0.1 -> -17.0999999999999 | E158: 42 | F158: 28 | G158: 15 | H158: -16.8 | I158: 45 | J158: 34 | K158: -0.9
A159: 43 | B159: 56 | C159: of:=[.C158]+0.1 -> 15.3 | D159: of:=[.D158]+0.1 -> -16.9999999999999 | E159: 45 | F159: 29 | G159: 15.1 | H159: -16.7 | I159: 48 | J159: 45 | K159: -0.8
A160: 47 | B160: 7 | C160: of:=[.C159]+0.1 -> 15.4 | D160: of:=[.D159]+0.1 -> -16.8999999999999 | E160: 48 | F160: 52 | G160: 15.2 | H160: -16.6 | I160: 52 | J160: 16 | K160: -0.699999999999999
A161: 50 | B161: 43 | C161: of:=[.C160]+0.1 -> 15.5 | D161: of:=[.D160]+0.1 -> -16.7999999999999 | E161: 52 | F161: 41 | G161: 15.3 | H161: -16.5 | I161: 56 | J161: 9 | K161: -0.6
A162: 54 | B162: 46 | C162: of:=[.C161]+0.1 -> 15.6 | D162: of:=[.D161]+0.1 -> -16.6999999999999 | E162: 56 | F162: 59 | G162: 15.4 | H162: -16.4 | I162: 60 | J162: 26 | K162: -0.499999999999999
A163: 59 | B163: 21 | C163: of:=[.C162]+0.1 -> 15.7 | D163: of:=[.D162]+0.1 -> -16.5999999999999 | E163: 61 | F163: 50 | G163: 15.5 | H163: -16.3 | I163: 65 | J163: 6 | K163: -0.399999999999999
A164: 64 | B164: 28 | C164: of:=[.C163]+0.1 -> 15.8 | D164: of:=[.D163]+0.1 -> -16.4999999999999 | E164: 67 | F164: 15 | G164: 15.6 | H164: -16.2 | I164: 70 | J164: 9 | K164: -0.3
A165: 70 | B165: 10 | C165: of:=[.C164]+0.1 -> 15.9 | D165: of:=[.D164]+0.1 -> -16.3999999999999 | E165: 73 | F165: 14 | G165: 15.7 | H165: -16.1 | I165: 75 | J165: 32 | K165: -0.199999999999999
A166: 76 | B166: 24 | C166: of:=[.C165]+0.1 -> 16 | D166: of:=[.D165]+0.1 -> -16.2999999999999 | E166: 79 | F166: 42 | G166: 15.8 | H166: -16 | I166: 81 | J166: 12 | K166: -0.0999999999999996
A167: 83 | B167: 5 | C167: of:=[.C166]+0.1 -> 16.1 | D167: of:=[.D166]+0.1 -> -16.1999999999999 | E167: 86 | F167: 31 | G167: 15.9 | H167: -15.9 | I167: 87 | J167: 3 | K167: 0